{
  "schema_version": "1.0.0",
  "response_id": "55555555-5555-4555-8555-555555555555",
  "request_id": "11111111-1111-4111-8111-111111111111",
  "run_id": "22222222-2222-4222-8222-222222222222",
  "timestamp": "2026-04-14T10:00:01Z",
  "status": "success",
  "result": {
    "process_count": 193
  },
  "artifacts": [
    {
      "artifact_id": "66666666-6666-4666-8666-666666666666",
      "type": "json",
      "path": "runs/2222/process-list.json",
      "checksum_sha256": "aaaaaaaaaaaaaaaaaaaaaaaaaaaaaaaaaaaaaaaaaaaaaaaaaaaaaaaaaaaaaaaa"
    }
  ],
  "metrics": {
    "duration_ms": 820,
    "attempts": 1,
    "cpu_ms": 40,
    "memory_mb": 12.5,
    "network_bytes_in": 0,
    "network_bytes_out": 0
  },
  "policy_decision": {
    "decision": "allow",
    "risk_tier": "low",
    "rule_id": "policy.local.readonly",
    "reason": "Allowed read-only command",
    "evaluated_at": "2026-04-14T10:00:00Z"
  },
  "validation": {
    "passed": true,
    "checks": [
      {
        "name": "command_exit_code",
        "passed": true,
        "details": "Exit code 0"
      }
    ]
  },
  "trace": {
    "trace_id": "aaaaaaaaaaaaaaaaaaaaaaaaaaaaaaaa",
    "span_id": "cccccccccccccccc",
    "parent_span_id": "bbbbbbbbbbbbbbbb",
    "correlation_id": "44444444-4444-4444-8444-444444444444"
  },
  "metadata": {
    "host": "local"
  }
}
